{
  "version": 1,
  "id": "02-l-bend",
  "name": "The Elbow",
  "par": 3,
  "bounds": { "x": 0, "y": 0, "w": 30, "h": 60 },
  "walls": [
    { "a": { "x": 17, "y": 56 }, "b": { "x": 17, "y": 18 } },
    { "a": { "x": 17, "y": 18 }, "b": { "x": 5, "y": 18 } },
    { "a": { "x": 5, "y": 18 }, "b": { "x": 5, "y": 10 } },
    { "a": { "x": 5, "y": 10 }, "b": { "x": 22, "y": 10 } },
    { "a": { "x": 22, "y": 10 }, "b": { "x": 25, "y": 13 } },
    { "a": { "x": 25, "y": 13 }, "b": { "x": 25, "y": 56 } },
    { "a": { "x": 25, "y": 56 }, "b": { "x": 17, "y": 56 } }
  ],
  "tee": { "x": 21, "y": 50 },
  "cup": { "x": 9, "y": 14 },
  "surfaceZones": [],
  "slopeZones": [],
  "hazards": [],
  "obstacles": []
}
